{
  "functionalCoverage": [
    {
      "acceptanceCriteria": "FR-001-AC-1",
      "functionalReq": "FR-001",
      "line": 49,
      "status": {
        "marker": "\u2705",
        "note": "Complete"
      },
      "testCases": "TC-001"
    },
    {
      "acceptanceCriteria": "FR-001-AC-2",
      "functionalReq": "FR-001",
      "line": 50,
      "status": {
        "marker": "\u2705",
        "note": "Complete"
      },
      "testCases": "TC-002"
    }
  ],
  "id": "TM-001",
  "provenance": {
    "digest": "sha256:6d07fcc30a52a918eca5102f6359fb1032c157db64fdb33c3cb08907ed107a2f",
    "path": "skeletons/TestMatrix.md"
  },
  "testCases": [
    {
      "id": "TC-001",
      "line": 56,
      "priority": "P0",
      "status": {
        "marker": "\u2705"
      },
      "title": "A matching digest persists the artifact",
      "tracesTo": {
        "noTrace": false,
        "tokens": [
          "FR-001-AC-1"
        ]
      },
      "type": "Unit"
    },
    {
      "id": "TC-002",
      "line": 57,
      "priority": "P0",
      "status": {
        "marker": "\u2705"
      },
      "title": "A mismatched digest rejects the import and names both digests",
      "tracesTo": {
        "noTrace": false,
        "tokens": [
          "FR-001-AC-2"
        ]
      },
      "type": "Unit"
    },
    {
      "id": "TC-003",
      "line": 58,
      "priority": "P2",
      "status": {
        "marker": "\ud83d\udea7",
        "note": "not yet run at scale"
      },
      "title": "Import throughput holds at the declared threshold",
      "tracesTo": {
        "noTrace": false,
        "tokens": [
          "FR-003-AC-1"
        ]
      },
      "type": "Benchmark"
    },
    {
      "id": "TC-004",
      "line": 59,
      "priority": "P1",
      "status": {
        "marker": "\u26d4",
        "note": "superseded by TC-001"
      },
      "title": "Digest computed before any transform",
      "tracesTo": {
        "noTrace": true,
        "tokens": []
      },
      "type": "Unit"
    }
  ],
  "title": "Example module test matrix",
  "type": "TestMatrix"
}
